{
  "schemaVersion": "1.0.0",
  "id": "IOS-003.1-FIGMA-COLOR-VARIABLE-CAPTURE",
  "milestone": "IOS-003.1",
  "status": "captured-pending-human-review",
  "capturedAt": "2026-08-05T08:35:16Z",
  "fileKey": "OJqxFKoGjRh4rrSZCKdkzi",
  "pageNodeId": "2:4",
  "sourceRevision": "f3c4f0edff4a935deb9f3411ce074698b96c6169",
  "collections": [
    {
      "name": "Primitive",
      "collectionId": "VariableCollectionId:63:14",
      "defaultModeId": "63:0",
      "modes": [
        {
          "name": "Mode 1",
          "modeId": "63:0"
        }
      ],
      "colorVariableCount": 32,
      "hiddenFromPublishing": true
    },
    {
      "name": "Semantic",
      "collectionId": "VariableCollectionId:63:15",
      "defaultModeId": "63:1",
      "modes": [
        {
          "name": "Mode 1",
          "modeId": "63:1"
        }
      ],
      "colorVariableCount": 24,
      "hiddenFromPublishing": true
    },
    {
      "name": "Theme",
      "collectionId": "VariableCollectionId:63:16",
      "defaultModeId": "63:2",
      "modes": [
        {
          "name": "Light",
          "modeId": "63:2"
        },
        {
          "name": "Dark",
          "modeId": "63:5"
        }
      ],
      "colorVariableCount": 24,
      "hiddenFromPublishing": true
    },
    {
      "name": "Responsive",
      "collectionId": "VariableCollectionId:63:17",
      "defaultModeId": "63:3",
      "modes": [
        {
          "name": "Mode 1",
          "modeId": "63:3"
        }
      ],
      "colorVariableCount": 0,
      "hiddenFromPublishing": true
    },
    {
      "name": "Motion",
      "collectionId": "VariableCollectionId:63:18",
      "defaultModeId": "63:4",
      "modes": [
        {
          "name": "Mode 1",
          "modeId": "63:4"
        }
      ],
      "colorVariableCount": 0,
      "hiddenFromPublishing": true
    }
  ],
  "primitiveVariables": [
    {
      "canonicalTokenPath": "color.primitive.neutral.0",
      "figmaName": "color/primitive/neutral/0",
      "variableId": "VariableID:64:14",
      "collectionId": "VariableCollectionId:63:14"
    },
    {
      "canonicalTokenPath": "color.primitive.neutral.50",
      "figmaName": "color/primitive/neutral/50",
      "variableId": "VariableID:64:15",
      "collectionId": "VariableCollectionId:63:14"
    },
    {
      "canonicalTokenPath": "color.primitive.neutral.100",
      "figmaName": "color/primitive/neutral/100",
      "variableId": "VariableID:64:16",
      "collectionId": "VariableCollectionId:63:14"
    },
    {
      "canonicalTokenPath": "color.primitive.neutral.200",
      "figmaName": "color/primitive/neutral/200",
      "variableId": "VariableID:64:17",
      "collectionId": "VariableCollectionId:63:14"
    },
    {
      "canonicalTokenPath": "color.primitive.neutral.300",
      "figmaName": "color/primitive/neutral/300",
      "variableId": "VariableID:64:18",
      "collectionId": "VariableCollectionId:63:14"
    },
    {
      "canonicalTokenPath": "color.primitive.neutral.500",
      "figmaName": "color/primitive/neutral/500",
      "variableId": "VariableID:64:19",
      "collectionId": "VariableCollectionId:63:14"
    },
    {
      "canonicalTokenPath": "color.primitive.neutral.700",
      "figmaName": "color/primitive/neutral/700",
      "variableId": "VariableID:64:20",
      "collectionId": "VariableCollectionId:63:14"
    },
    {
      "canonicalTokenPath": "color.primitive.neutral.800",
      "figmaName": "color/primitive/neutral/800",
      "variableId": "VariableID:64:21",
      "collectionId": "VariableCollectionId:63:14"
    },
    {
      "canonicalTokenPath": "color.primitive.neutral.900",
      "figmaName": "color/primitive/neutral/900",
      "variableId": "VariableID:64:22",
      "collectionId": "VariableCollectionId:63:14"
    },
    {
      "canonicalTokenPath": "color.primitive.neutral.950",
      "figmaName": "color/primitive/neutral/950",
      "variableId": "VariableID:64:23",
      "collectionId": "VariableCollectionId:63:14"
    },
    {
      "canonicalTokenPath": "color.primitive.blue.50",
      "figmaName": "color/primitive/blue/50",
      "variableId": "VariableID:64:24",
      "collectionId": "VariableCollectionId:63:14"
    },
    {
      "canonicalTokenPath": "color.primitive.blue.200",
      "figmaName": "color/primitive/blue/200",
      "variableId": "VariableID:64:25",
      "collectionId": "VariableCollectionId:63:14"
    },
    {
      "canonicalTokenPath": "color.primitive.blue.400",
      "figmaName": "color/primitive/blue/400",
      "variableId": "VariableID:64:26",
      "collectionId": "VariableCollectionId:63:14"
    },
    {
      "canonicalTokenPath": "color.primitive.blue.600",
      "figmaName": "color/primitive/blue/600",
      "variableId": "VariableID:64:27",
      "collectionId": "VariableCollectionId:63:14"
    },
    {
      "canonicalTokenPath": "color.primitive.blue.700",
      "figmaName": "color/primitive/blue/700",
      "variableId": "VariableID:64:28",
      "collectionId": "VariableCollectionId:63:14"
    },
    {
      "canonicalTokenPath": "color.primitive.blue.800",
      "figmaName": "color/primitive/blue/800",
      "variableId": "VariableID:64:29",
      "collectionId": "VariableCollectionId:63:14"
    },
    {
      "canonicalTokenPath": "color.primitive.blue.900",
      "figmaName": "color/primitive/blue/900",
      "variableId": "VariableID:64:30",
      "collectionId": "VariableCollectionId:63:14"
    },
    {
      "canonicalTokenPath": "color.primitive.green.50",
      "figmaName": "color/primitive/green/50",
      "variableId": "VariableID:64:31",
      "collectionId": "VariableCollectionId:63:14"
    },
    {
      "canonicalTokenPath": "color.primitive.green.200",
      "figmaName": "color/primitive/green/200",
      "variableId": "VariableID:64:32",
      "collectionId": "VariableCollectionId:63:14"
    },
    {
      "canonicalTokenPath": "color.primitive.green.600",
      "figmaName": "color/primitive/green/600",
      "variableId": "VariableID:64:33",
      "collectionId": "VariableCollectionId:63:14"
    },
    {
      "canonicalTokenPath": "color.primitive.green.800",
      "figmaName": "color/primitive/green/800",
      "variableId": "VariableID:64:34",
      "collectionId": "VariableCollectionId:63:14"
    },
    {
      "canonicalTokenPath": "color.primitive.green.950",
      "figmaName": "color/primitive/green/950",
      "variableId": "VariableID:64:35",
      "collectionId": "VariableCollectionId:63:14"
    },
    {
      "canonicalTokenPath": "color.primitive.red.50",
      "figmaName": "color/primitive/red/50",
      "variableId": "VariableID:64:36",
      "collectionId": "VariableCollectionId:63:14"
    },
    {
      "canonicalTokenPath": "color.primitive.red.200",
      "figmaName": "color/primitive/red/200",
      "variableId": "VariableID:64:37",
      "collectionId": "VariableCollectionId:63:14"
    },
    {
      "canonicalTokenPath": "color.primitive.red.600",
      "figmaName": "color/primitive/red/600",
      "variableId": "VariableID:64:38",
      "collectionId": "VariableCollectionId:63:14"
    },
    {
      "canonicalTokenPath": "color.primitive.red.800",
      "figmaName": "color/primitive/red/800",
      "variableId": "VariableID:64:39",
      "collectionId": "VariableCollectionId:63:14"
    },
    {
      "canonicalTokenPath": "color.primitive.red.950",
      "figmaName": "color/primitive/red/950",
      "variableId": "VariableID:64:40",
      "collectionId": "VariableCollectionId:63:14"
    },
    {
      "canonicalTokenPath": "color.primitive.amber.50",
      "figmaName": "color/primitive/amber/50",
      "variableId": "VariableID:64:41",
      "collectionId": "VariableCollectionId:63:14"
    },
    {
      "canonicalTokenPath": "color.primitive.amber.200",
      "figmaName": "color/primitive/amber/200",
      "variableId": "VariableID:64:42",
      "collectionId": "VariableCollectionId:63:14"
    },
    {
      "canonicalTokenPath": "color.primitive.amber.600",
      "figmaName": "color/primitive/amber/600",
      "variableId": "VariableID:64:43",
      "collectionId": "VariableCollectionId:63:14"
    },
    {
      "canonicalTokenPath": "color.primitive.amber.800",
      "figmaName": "color/primitive/amber/800",
      "variableId": "VariableID:64:44",
      "collectionId": "VariableCollectionId:63:14"
    },
    {
      "canonicalTokenPath": "color.primitive.amber.950",
      "figmaName": "color/primitive/amber/950",
      "variableId": "VariableID:64:45",
      "collectionId": "VariableCollectionId:63:14"
    }
  ],
  "themeVariables": [
    {
      "canonicalTokenPath": "color.theme.background.canvas",
      "figmaName": "color/theme/background/canvas",
      "variableId": "VariableID:66:14",
      "collectionId": "VariableCollectionId:63:16",
      "lightAlias": {
        "canonicalTokenPath": "color.primitive.neutral.0",
        "variableId": "VariableID:64:14"
      },
      "darkAlias": {
        "canonicalTokenPath": "color.primitive.neutral.950",
        "variableId": "VariableID:64:23"
      }
    },
    {
      "canonicalTokenPath": "color.theme.background.inverse",
      "figmaName": "color/theme/background/inverse",
      "variableId": "VariableID:66:15",
      "collectionId": "VariableCollectionId:63:16",
      "lightAlias": {
        "canonicalTokenPath": "color.primitive.neutral.950",
        "variableId": "VariableID:64:23"
      },
      "darkAlias": {
        "canonicalTokenPath": "color.primitive.neutral.0",
        "variableId": "VariableID:64:14"
      }
    },
    {
      "canonicalTokenPath": "color.theme.background.subtle",
      "figmaName": "color/theme/background/subtle",
      "variableId": "VariableID:66:16",
      "collectionId": "VariableCollectionId:63:16",
      "lightAlias": {
        "canonicalTokenPath": "color.primitive.neutral.100",
        "variableId": "VariableID:64:16"
      },
      "darkAlias": {
        "canonicalTokenPath": "color.primitive.neutral.800",